{
  "version": 2,
  "contract": "manager-snapshot",
  "regletHome": "/tmp/reglet-empty",
  "safety": { "localOnly": true, "requiresExplicitReview": true },
  "providerDiscovery": [],
  "sourceInventory": [],
  "enrollmentMatrix": [],
  "master": {
    "rules": { "sharedDocuments": 0, "providerOverlays": { "claude": 0, "codex": 0, "cursor": 0, "gemini": 0, "windsurf": 0, "opencode": 0 } },
    "skills": { "sharedSkills": 0, "providerScopedSkills": { "claude": 0, "codex": 0, "cursor": 0, "gemini": 0, "windsurf": 0, "opencode": 0 } },
    "mcp": { "sharedServers": [], "providerServers": { "claude": [], "codex": [], "cursor": [], "gemini": [], "windsurf": [], "opencode": [] } }
  },
  "state": { "state": "draftOnly", "reasons": ["noDestinationsEnrolled"] },
  "problems": [],
  "effectiveProviders": [],
  "structuredPlan": { "available": false, "reason": "snapshot-read-only", "entries": [] },
  "driftInbox": [],
  "receipts": { "list": [], "details": [] },
  "legacyNetworkState": { "present": false, "paths": [] }
}
